{
  "schemaVersion": 1,
  "runId": "mpf6ibvc-0f57gz",
  "capturedAt": "2026-05-21T07:38:14.040Z",
  "durationMs": 4576,
  "control": {
    "path": "C:\\Github.Copilot\\PowerApps\\PCFWorkbench\\samples\\MAILoopBroken\\MAILoopBroken"
  },
  "build": {
    "ok": true,
    "skipped": true,
    "durationMs": 0,
    "errors": []
  },
  "harness": {
    "url": "http://127.0.0.1:8181/",
    "ok": true,
    "consoleErrors": [],
    "pageErrors": [],
    "report": {
      "schemaVersion": 1,
      "capturedAt": 1779349093926,
      "control": {
        "namespace": "PcfWorkbench",
        "constructor": "MAILoopBroken",
        "version": "0.0.1",
        "type": "virtual"
      },
      "lifecycle": {
        "events": [
          {
            "method": "init",
            "durationMs": 0.10000002384185791,
            "timestamp": 1779349093217
          },
          {
            "method": "updateView",
            "durationMs": 6.600000023841858,
            "timestamp": 1779349093238
          },
          {
            "method": "destroy",
            "durationMs": 0,
            "timestamp": 1779349093862
          }
        ],
        "initCalled": true,
        "firstUpdateViewMs": 21
      },
      "performance": {
        "renderCount": 1,
        "lastRenderTimeMs": 6.600000023841858,
        "avgRenderTimeMs": 6.6,
        "domNodeCount": 1,
        "jsHeapUsedMB": 87.45193481445312
      },
      "leaks": [
        {
          "type": "eventListener",
          "detail": "window.addEventListener(\"resize\") not removed"
        },
        {
          "type": "timer",
          "detail": "setInterval(1000ms) not cleared"
        },
        {
          "type": "observer",
          "detail": "MutationObserver.disconnect() not called"
        }
      ],
      "webApi": {
        "totalCalls": 0,
        "errorCount": 0,
        "calls": []
      },
      "logs": {
        "recent": [
          {
            "category": "data",
            "method": "reload"
          },
          {
            "category": "lifecycle",
            "method": "init"
          },
          {
            "category": "lifecycle",
            "method": "updateView"
          },
          {
            "category": "lifecycle",
            "method": "destroy"
          },
          {
            "category": "lifecycle",
            "method": "destroy"
          }
        ],
        "unimplementedCount": 0
      }
    },
    "screenshot": "screenshot.png"
  },
  "budget": null,
  "summary": {
    "status": "warn",
    "headline": "3 resource leak(s)",
    "errors": 0,
    "leaks": 3
  }
}